{
    "type": "resourcefulbees:mutation",
    "pollenTopColor": "#339786",
    "pollenBaseColor": "#339786",
    "mutations" : [
        {
            "input": {
                "type": "block",
                "block": {
                    "id": "minecraft:end_stone"
                },
                "chance": 0.5
            },
            "outputs" : [
                {
                    "type": "block",
                    "block": {
                        "id": "minecraft:obsidian"
                    }
                }
            ]
        }
    ]
}