{
    "type": "resourcefulbees:mutation",
    "pollenBaseColor": "#8d5f09",
    "pollenTopColor": "#978f2e",
    "mutations" : [
        {
            "input": {
                "type": "block",
                "block": {
                    "id": "minecraft:stone"
                },
                "chance": 0.75
            },
            "outputs" : [
                {
                    "type": "block",
                    "block": {
                        "id": "minecraft:gold_ore"
                    },
                    "weight": 25
                },
                {
                    "type": "block",
                    "block": {
                        "id": "minecraft:cobblestone"
                    },
                    "weight": 75
                }
            ]
        }
    ]
}