{
    "type": "resourcefulbees:mutation",
    "pollenBaseColor": "#8b8a7e",
    "pollenTopColor": "#bc8d6f",
    "mutations": [
        {
            "input": {
                "type": "entity",
                "entity": {
                    "type": "minecraft:cow"
                }
            },
            "outputs": [
                {
                    "type": "entity",
                    "entity": {
                        "type": "minecraft:mooshroom",
                        "nbt": {
                            "Type": "brown"
                        }
                    }
                }
            ]
        }
    ]
}