{
    "type": "resourcefulbees:mutation",
    "pollenBaseColor": "#451f1f",
    "pollenTopColor": "#8d8a86",
    "mutations": [
        {
            "input": {
                "type": "block",
                "block": {
                    "id": "minecraft:netherrack"
                }
            },
            "outputs" : [
                {
                    "type": "block",
                    "block": {
                        "id": "minecraft:nether_quartz_ore"
                    }
                },
                {
                    "type": "block",
                    "block": {
                        "id": "minecraft:cobblestone"
                    }
                }
            ]
        }
    ]
}