{
    "type": "resourcefulbees:mutation",
    "pollenBaseColor": "#ce1111",
    "pollenTopColor": "#e72727",
    "mutations": [
        {
            "input": {
                "type": "block",
                "block": {
                    "id": "minecraft:grass_block"
                }
            },
            "outputs" : [
                {
                    "type": "block",
                    "block": {
                        "id": "minecraft:red_mushroom"
                    }
                }
            ]
        },
        {
            "input": {
                "type": "entity",
                "entity": {
                    "type": "minecraft:cow"
                }
            },
            "outputs" : [
                {
                    "type": "entity",
                    "entity": {
                        "type": "minecraft:mooshroom"
                    }
                }
            ]
        }
    ]
}