{
    "type": "resourcefulbees:mutation",
    "pollenBaseColor" : "#137d81",
    "pollenTopColor": "#488b7e",
    "mutations" : [
        {
            "input": {
                "type": "block",
                "block": {
                    "id": "minecraft:stone"
                },
                "chance": 0.50
            },
            "outputs" : [
                {
                    "type": "block",
                    "block": {
                        "id": "minecraft:diamond_ore"
                    },
                    "weight": 10
                },
                {
                    "type": "block",
                    "block": {
                        "id": "minecraft:cobblestone"
                    },
                    "weight": 90
                }
            ]
        }
    ]
}